{
  "match": {
    "entity_type": "ebb:npc",
    "name": "Ebb NPC: innkeeper_day"
  },
  "dialogue": "ebb:demo/innkeeper_intro",
  "interaction_range": 2.5,
  "highlight_range": 10.0,
  "priority": 640,
  "highlight": {
    "color": "#76F2B2",
    "opacity": 1.0,
    "far_opacity": 0.6,
    "render_mode": "outline",
    "priority": 40
  }
}
