{
  "match": {
    "entity_type": "ebb:npc",
    "tags": [
      "ebb.npc.demo.innkeeper",
      "ebb.npc.demo.innkeeper_day",
      "ebb.npc.innkeeper",
      "ebb.npc.innkeeper_day"
    ]
  },
  "dialogue": "ebb:demo/innkeeper_intro",
  "interaction_range": 2.5,
  "highlight_range": 10.0,
  "priority": 600,
  "highlight": {
    "color": "#76F2B2",
    "opacity": 1.0,
    "far_opacity": 0.6,
    "render_mode": "outline",
    "priority": 40
  }
}
