{
  "match": {
    "entity_type": "ebb:npc",
    "name": "Ebb NPC: courier_day"
  },
  "dialogue": "ebb:demo/courier_intro",
  "interaction_range": 2.5,
  "highlight_range": 10.0,
  "priority": 620,
  "highlight": {
    "color": "#ffd27a",
    "opacity": 0.55,
    "render_mode": "outline",
    "priority": 120
  }
}
